{
  "id": "grc.pisteuo",
  "strongs": "G4100",
  "language": "greek",
  "lemma": "πιστεύω",
  "transliteration": "pisteuo",
  "partOfSpeech": "verb",
  "status": "draft",

  "preferredRenderings": [
    "creer"
  ],

  "alternativeRenderings": [
    "confiar"
  ],

  "coreIdea": "Creer o confiar según el contexto.",

  "translationNotes": "LBF debe preservar 'creer' siempre que el español comunique adecuadamente el sentido del texto.",

  "translationWarnings": [
    "No reducir πιστεύω a aceptación intelectual.",
    "No importar definiciones doctrinales.",
    "Observar cuidadosamente su relación con πίστις."
  ],

  "observations": [],
  "contexts": [],
  "family": [
    "G4102"
  ],
  "related": [],
  "examples": [],

  "metadata": {
    "created": "2026-06-30",
    "updated": "2026-06-30",
    "version": 1
  }
}